### ISSUE TITLE
Answers to the challenge

### ISSUE THREAD

**Issue by jizusun** [jizusun/challenge-part3#1]
## DEVOPS CHALLENGE

We ask you to complete this challenge within 2 days, but don’t expect you to spend more than 3 to 5 hours on it. Once you have finished, please email your solution to zhaojing@tesla.com.

Feel free to email us if you have questions or run into problems.

## Part 1.

Given a simple single stack:

`Client -> Internet -> Firewall -> 1 app server -> 1 DB server`

Answer the following questions:

- Identify possible points of failure.
    - Client: is an outdated app or web browser, capabilities/APIs missing
    - Internet: is slow or unstable
    - Firewall: not working because of the misconfiguration, Denial of Service
    - 1 app server: hardware issues, disk is full, the app process killed because out of memory, bug brought by
    - 1 DB server: hardware issues, disk is full, data loss because of the misconfiguration
- Design a possible solution that would mitigate the risks identified.
    - Client
        - [Graceful degradation](https://developer.mozilla.org/en-US/docs/Glossary/Graceful_degradation): Use less fancy UI/UX to interact with the user, or notify users to upgrade their client or web browser
        - Automatically downgrade from `hi-fi` to `low-fidelity` audio/video
    - Internet:
        - consider `offline-first`, using cache even if the Internet isn't working, use `Progressive Web App` if it is a web application
        - Use `CDN`: caching for static content or optimized network path for dynamic content
    - Firewall
        - Active/Standby Failover
        - Change Management: Easy to rollback the configuration using VCS(version control system)
        - Monitor the traffic
    - 1 app Server
        - Load-balancers in front of the app servers (replicas)
        - Daemon (pm2, systemd) to safeguard the application process
        - Containerize the app for restarting containers when they exit
        - Monitor the saturation of the disk usage
        - Canary release, a/b testing
        - Continuous Integration for the application development
        - Caching (redis)
    - 1 db server
        - Database replication for High Availability
        - Read/Write splitting
        - Backup database
        - Least privileges access for human and for service

## Part 2.

Analyze the enclosed file, part2/to analyze. Your analysis should include the following:

- What kind of file is this?
`to_analyze: pcap capture file, microsecond ts (little-endian) - version 2.4 (Ethernet, capture length 262144)`, which can be easily viewed by `wireshark`
- What story does it tell?

    Succinct answer: In the browser, visit [http://tesla.com](http://tesla.com)

    More detailed answer:

    1. `GET http://tesla.com`
    2. The first response is `302 Found`, redirected to: [https://www.tesla.com/](https://www.tesla.com/)
    3. `GET https://www.tesla.com/`
    4. Subsequent HTTPS requests to the resources references by the above webpage: 
        1. [tesla.com](http://tesla.com)
        2. www.googletagmanager.com
        3. location.teslamotors.com
        4. xxx.dscx.akamaiedge.net
        5. xxx.qualtrics.com
        6. xxx.ls.apple.com
- Select a few records from the file and describe each of the fields in them.

```
7	0.022955	205.234.27.221	10.177.112.99	HTTP	177	HTTP/1.0 302 Found

Frame 7: 177 bytes on wire (1416 bits), 177 bytes captured (1416 bits)
    Encapsulation type: Ethernet (1)
    Arrival Time: Apr  1, 2017 06:38:21.425800000 CST
    [Time shift for this packet: 0.000000000 seconds]
    Epoch Time: 1490999901.425800000 seconds
    [Time delta from previous captured frame: 0.007600000 seconds]
    [Time delta from previous displayed frame: 0.007600000 seconds]
    [Time since reference or first frame: 0.022955000 seconds]
    Frame Number: 7
    Frame Length: 177 bytes (1416 bits)
    Capture Length: 177 bytes (1416 bits)
    [Frame is marked: False]
    [Frame is ignored: False]
    [Protocols in frame: eth:ethertype:ip:tcp:http]
    [Coloring Rule Name: HTTP]
    [Coloring Rule String: http || tcp.port == 80 || http2]
Ethernet II, Src: JuniperN_ff:10:00 (00:10:db:ff:10:00), Dst: Apple_92:81:a3 (ac:bc:32:92:81:a3)
    Destination: Apple_92:81:a3 (ac:bc:32:92:81:a3)
        Address: Apple_92:81:a3 (ac:bc:32:92:81:a3)
        .... ..0. .... .... .... .... = LG bit: Globally unique address (factory default)
        .... ...0 .... .... .... .... = IG bit: Individual address (unicast)
    Source: JuniperN_ff:10:00 (00:10:db:ff:10:00)
        Address: JuniperN_ff:10:00 (00:10:db:ff:10:00)
        .... ..0. .... .... .... .... = LG bit: Globally unique address (factory default)
        .... ...0 .... .... .... .... = IG bit: Individual address (unicast)
    Type: IPv4 (0x0800)
Internet Protocol Version 4, Src: 205.234.27.221, Dst: 10.177.112.99
    0100 .... = Version: 4
    .... 0101 = Header Length: 20 bytes (5)
    Differentiated Services Field: 0x00 (DSCP: CS0, ECN: Not-ECT)
    Total Length: 163
    Identification: 0x76db (30427)
    Flags: 0x40, Don't fragment
    Fragment Offset: 0
    Time to Live: 241
    Protocol: TCP (6)
    Header Checksum: 0xad9d [validation disabled]
    [Header checksum status: Unverified]
    Source Address: 205.234.27.221
    Destination Address: 10.177.112.99
Transmission Control Protocol, Src Port: 80, Dst Port: 63194, Seq: 1, Ack: 332, Len: 111
    Source Port: 80
    Destination Port: 63194
    [Stream index: 0]
    [TCP Segment Len: 111]
    Sequence Number: 1    (relative sequence number)
    Sequence Number (raw): 445098636
    [Next Sequence Number: 112    (relative sequence number)]
    Acknowledgment Number: 332    (relative ack number)
    Acknowledgment number (raw): 4010063682
    1000 .... = Header Length: 32 bytes (8)
    Flags: 0x018 (PSH, ACK)
    Window: 4158
    [Calculated window size: 4158]
    [Window size scaling factor: -2 (no window scaling used)]
    Checksum: 0x350c [unverified]
    [Checksum Status: Unverified]
    Urgent Pointer: 0
    Options: (12 bytes), No-Operation (NOP), No-Operation (NOP), Timestamps
    [SEQ/ACK analysis]
    [Timestamps]
    TCP payload (111 bytes)
Hypertext Transfer Protocol
    HTTP/1.0 302 Found\r\n
    Location: https://www.tesla.com/\r\n
    Server: LB\r\n
    Connection: Keep-Alive\r\n
    Content-Length: 0\r\n
    \r\n
    [HTTP response 1/1]
    [Time since request: 0.007600000 seconds]
    [Request in frame: 6]
    [Request URI: http://tesla.com/]
```

## Part 3.

Imagine that a manufacturing engineering team needs a new Ignition server. (To minimize the
scope of this exercise, we won’t worry about how the host is built.) We will use Vagrant and
Virtualbox to manage a local instance, and the Vagrant “provision” functionality to configure
the server. See the **Vagrant** section below for more info.

Write code that brings the server from the base OS installation to being ready for
manufacturing engineers to configure Ignition. The application requires the following:

- Nginx as a reverse proxy
- Ignition (from Inductive Automation) [https://docs.inductiveautomation.com/display/DOC/Installing+Ignition+on+Linux](https://docs.inductiveautomation.com/display/DOC/Installing+Ignition+on+Linux)
- Host-based firewall configuration (such as iptables or netfilter) so that the application is only
accessible from the 10.0.0.0/8 subnet

You should aim to provide a simple but robust solution which others could easily use and
extend.

Your solution should be implemented in a standard open-source tool chain using commonly
available libraries and tools. We have provided templates for three common tool chains, but
feel free to use another one if you prefer. Favor terse simplicity over attempting to guard
against all edge cases.

Your submission should include:

1. Instructions on how to build / execute your code 
2. Source code [https://github.com/jizusun/challenge-part3](https://github.com/jizusun/challenge-part3)
3. Discussion topics

a. A paragraph or two around each topic should suffice

As part of your submission, include some thoughts around the discussion topics below:

## Source Code 

[https://github.com/jizusun/challenge-part3](https://github.com/jizusun/challenge-part3)

### 1. How would you make the destination port of the application configurable in Nginx, so this
could be used for other applications?

With my work, due to the time limit, I deployed `nginx` as a server rather than a `reverse proxy` to `Ignition`. Sorry for this.

But with the question for **making  the destination port of the application configurable in Nginx**, we can use [the `Ansible vars` feature](https://docs.ansible.com/ansible/latest/user_guide/playbooks_variables.html).

### 2. How would you test the repeatability of this automation?

As mentioned in the instruction below, to test the automation:

- Manual: `SSH` into the `client` with two NIC (check the [Vagrantfile](https://github.com/jizusun/challenge-part3/blob/409b606251b300b3e8133f64e29a2c7dc9853103/Vagrantfile#L25-L30)), and `curl` with two different destination IP
- Automatic: not investigated yet

### 3. How would you monitor the application and dependent services?

We can use `blackbox_exporter` : [https://github.com/prometheus/blackbox_exporter](https://github.com/prometheus/blackbox_exporter)

## Instructions on how to build / execute code

```bash
git clone git@github.com:jizusun/challenge-part3.git
cd challenge-par3
vagrant up

vagrant ssh client
curl 192.168.0.42 # connection refused
curl -I 10.0.0.2 # okay
```

![image](https://user-images.githubusercontent.com/4011348/109423512-a91e3680-7a1a-11eb-94fb-1b1bccfe355a.png)
